{
  "exhibitors": [
    {
      "categoryIds": [
        "exhibitor"
      ],
      "id": "exhibitor-artesanato-santista",
      "name": "ARTESANATO SANTISTA",
      "normalizedName": "artesanato santista",
      "occurrences": [
        {
          "occurrenceIndex": 1,
          "originalText": "ARTESANATO SANTISTA",
          "standId": "stand-travessa-30"
        }
      ],
      "roles": [
        "exhibitor"
      ],
      "slug": "artesanato-santista",
      "source": {
        "file": "BIL26-0526.pdf",
        "page": 1,
        "type": "pdf-map"
      },
      "standIds": [
        "stand-travessa-30"
      ],
      "validation": {
        "confidence": 0.99,
        "notes": [
          "Drafting dimension labels were removed after manual comparison with the source PDF."
        ],
        "status": "validated",
        "evidence": [
          "manual-visual-review-against-source-pdf"
        ]
      }
    },
    {
      "categoryIds": [
        "exhibitor"
      ],
      "id": "exhibitor-barraco-editorial",
      "name": "BARRACO EDITORIAL",
      "normalizedName": "barraco editorial",
      "occurrences": [
        {
          "occurrenceIndex": 1,
          "originalText": "BARRACO EDITORIAL",
          "standId": "stand-travessa-46"
        }
      ],
      "roles": [
        "exhibitor"
      ],
      "slug": "barraco-editorial",
      "source": {
        "file": "BIL26-0526.pdf",
        "page": 1,
        "type": "pdf-map"
      },
      "standIds": [
        "stand-travessa-46"
      ],
      "validation": {
        "confidence": 0.99,
        "notes": [
          "Drafting dimension labels were removed after manual comparison with the source PDF."
        ],
        "status": "validated",
        "evidence": [
          "manual-visual-review-against-source-pdf"
        ]
      }
    },
    {
      "categoryIds": [
        "exhibitor"
      ],
      "id": "exhibitor-diarios-embu",
      "name": "DIÁRIOS EMBU",
      "normalizedName": "diarios embu",
      "occurrences": [
        {
          "occurrenceIndex": 1,
          "originalText": "DIÁRIOS EMBU",
          "standId": "stand-travessa-10"
        }
      ],
      "roles": [
        "exhibitor"
      ],
      "slug": "diarios-embu",
      "source": {
        "file": "BIL26-0526.pdf",
        "page": 1,
        "type": "pdf-map"
      },
      "standIds": [
        "stand-travessa-10"
      ],
      "validation": {
        "confidence": 0.99,
        "notes": [
          "Drafting dimension labels were removed after manual comparison with the source PDF."
        ],
        "status": "validated",
        "evidence": [
          "manual-visual-review-against-source-pdf"
        ]
      }
    },
    {
      "categoryIds": [
        "exhibitor"
      ],
      "id": "exhibitor-editora-nua",
      "name": "EDITORA NUA",
      "normalizedName": "editora nua",
      "occurrences": [
        {
          "occurrenceIndex": 1,
          "originalText": "EDITORA NUA",
          "standId": "stand-travessa-32"
        }
      ],
      "roles": [
        "exhibitor"
      ],
      "slug": "editora-nua",
      "source": {
        "file": "BIL26-0526.pdf",
        "page": 1,
        "type": "pdf-map"
      },
      "standIds": [
        "stand-travessa-32"
      ],
      "validation": {
        "confidence": 0.99,
        "notes": [
          "Drafting dimension labels were removed after manual comparison with the source PDF."
        ],
        "status": "validated",
        "evidence": [
          "manual-visual-review-against-source-pdf"
        ]
      }
    },
    {
      "categoryIds": [
        "exhibitor"
      ],
      "id": "exhibitor-ironita-pereira",
      "name": "IRONITA PEREIRA",
      "normalizedName": "ironita pereira",
      "occurrences": [
        {
          "occurrenceIndex": 1,
          "originalText": "IRONITA PEREIRA",
          "standId": "stand-travessa-28"
        }
      ],
      "roles": [
        "exhibitor"
      ],
      "slug": "ironita-pereira",
      "source": {
        "file": "BIL26-0526.pdf",
        "page": 1,
        "type": "pdf-map"
      },
      "standIds": [
        "stand-travessa-28"
      ],
      "validation": {
        "confidence": 0.99,
        "notes": [
          "Drafting dimension labels were removed after manual comparison with the source PDF."
        ],
        "status": "validated",
        "evidence": [
          "manual-visual-review-against-source-pdf"
        ]
      }
    },
    {
      "categoryIds": [
        "exhibitor"
      ],
      "id": "exhibitor-labuck",
      "name": "LABUCK",
      "normalizedName": "labuck",
      "occurrences": [
        {
          "occurrenceIndex": 1,
          "originalText": "LABUCK",
          "standId": "stand-travessa-12"
        }
      ],
      "roles": [
        "exhibitor"
      ],
      "slug": "labuck",
      "source": {
        "file": "BIL26-0526.pdf",
        "page": 1,
        "type": "pdf-map"
      },
      "standIds": [
        "stand-travessa-12"
      ],
      "validation": {
        "confidence": 0.99,
        "notes": [
          "Drafting dimension labels were removed after manual comparison with the source PDF."
        ],
        "status": "validated",
        "evidence": [
          "manual-visual-review-against-source-pdf"
        ]
      }
    },
    {
      "categoryIds": [
        "exhibitor"
      ],
      "id": "exhibitor-lote-42",
      "name": "LOTE 42",
      "normalizedName": "lote 42",
      "occurrences": [
        {
          "occurrenceIndex": 1,
          "originalText": "LOTE 42",
          "standId": "stand-travessa-44"
        }
      ],
      "roles": [
        "exhibitor"
      ],
      "slug": "lote-42",
      "source": {
        "file": "BIL26-0526.pdf",
        "page": 1,
        "type": "pdf-map"
      },
      "standIds": [
        "stand-travessa-44"
      ],
      "validation": {
        "confidence": 0.99,
        "notes": [
          "Drafting dimension labels were removed after manual comparison with the source PDF."
        ],
        "status": "validated",
        "evidence": [
          "manual-visual-review-against-source-pdf"
        ]
      }
    },
    {
      "categoryIds": [
        "exhibitor"
      ],
      "id": "exhibitor-stefanie-cabanelas",
      "name": "STEFANIE CABANELAS",
      "normalizedName": "stefanie cabanelas",
      "occurrences": [
        {
          "occurrenceIndex": 1,
          "originalText": "STEFANIE CABANELAS",
          "standId": "stand-travessa-42"
        }
      ],
      "roles": [
        "exhibitor"
      ],
      "slug": "stefanie-cabanelas",
      "source": {
        "file": "BIL26-0526.pdf",
        "page": 1,
        "type": "pdf-map"
      },
      "standIds": [
        "stand-travessa-42"
      ],
      "validation": {
        "confidence": 0.99,
        "notes": [
          "Drafting dimension labels were removed after manual comparison with the source PDF."
        ],
        "status": "validated",
        "evidence": [
          "manual-visual-review-against-source-pdf"
        ]
      }
    },
    {
      "categoryIds": [
        "exhibitor"
      ],
      "id": "exhibitor-a-ruina-dourada",
      "name": "A RUÍNA DOURADA",
      "normalizedName": "a ruina dourada",
      "occurrences": [
        {
          "occurrenceIndex": 1,
          "originalText": "A RUÍNA DOURADA",
          "standId": "stand-travessa-37"
        }
      ],
      "roles": [
        "exhibitor"
      ],
      "slug": "a-ruina-dourada",
      "source": {
        "file": "BIL26-0526.pdf",
        "page": 1,
        "type": "pdf-map"
      },
      "standIds": [
        "stand-travessa-37"
      ],
      "validation": {
        "confidence": 0.95,
        "notes": [
          "Exact normalized-name grouping only; no fuzzy deduplication was applied."
        ],
        "status": "validated"
      }
    },
    {
      "categoryIds": [
        "entity"
      ],
      "id": "exhibitor-abdl",
      "name": "ABDL",
      "normalizedName": "abdl",
      "occurrences": [
        {
          "occurrenceIndex": 1,
          "originalText": "ABDL",
          "standId": "stand-k54"
        }
      ],
      "roles": [
        "entity"
      ],
      "slug": "abdl",
      "source": {
        "file": "BIL26-0526.pdf",
        "page": 1,
        "type": "pdf-map"
      },
      "standIds": [
        "stand-k54"
      ],
      "validation": {
        "confidence": 0.95,
        "notes": [
          "Exact normalized-name grouping only; no fuzzy deduplication was applied."
        ],
        "status": "validated"
      }
    },
    {
      "categoryIds": [
        "exhibitor"
      ],
      "id": "exhibitor-aberst",
      "name": "ABERST",
      "normalizedName": "aberst",
      "occurrences": [
        {
          "occurrenceIndex": 1,
          "originalText": "ABERST",
          "standId": "stand-j33"
        }
      ],
      "roles": [
        "exhibitor"
      ],
      "slug": "aberst",
      "source": {
        "file": "BIL26-0526.pdf",
        "page": 1,
        "type": "pdf-map"
      },
      "standIds": [
        "stand-j33"
      ],
      "validation": {
        "confidence": 0.95,
        "notes": [
          "Exact normalized-name grouping only; no fuzzy deduplication was applied."
        ],
        "status": "validated"
      }
    },
    {
      "categoryIds": [
        "exhibitor"
      ],
      "id": "exhibitor-abeu",
      "name": "ABEU",
      "normalizedName": "abeu",
      "occurrences": [
        {
          "occurrenceIndex": 1,
          "originalText": "ABEU",
          "standId": "stand-h34"
        }
      ],
      "roles": [
        "exhibitor"
      ],
      "slug": "abeu",
      "source": {
        "file": "BIL26-0526.pdf",
        "page": 1,
        "type": "pdf-map"
      },
      "standIds": [
        "stand-h34"
      ],
      "validation": {
        "confidence": 0.95,
        "notes": [